<xs:schema attributeFormDefault="unqualified" elementFormDefault="qualified" xmlns:xs="http://www.w3.org/2001/XMLSchema">
  <xs:element name="atomos">
    <xs:complexType>
      <xs:sequence>
        <xs:element name="atomo">
          <xs:complexType>
            <xs:sequence>
              <xs:element type="xs:string" name="nombre"/>
              <xs:element type="xs:string" name="simbolo"/>
              <xs:element type="xs:byte" name="numero_atomico"/>
              <xs:element type="xs:string" name="peso_atomico"/>
              <xs:element name="punto_ebullicion">
                <xs:complexType>
                  <xs:simpleContent>
                    <xs:extension base="xs:string">
                      <xs:attribute type="xs:string" name="unidades"/>
                    </xs:extension>
                  </xs:simpleContent>
                </xs:complexType>
              </xs:element>
              <xs:element name="carga">
                <xs:complexType>
                  <xs:simpleContent>
                    <xs:extension base="xs:byte">
                      <xs:attribute type="xs:string" name="tipo"/>
                    </xs:extension>
                  </xs:simpleContent>
                </xs:complexType>
              </xs:element>
            </xs:sequence>
            <xs:attribute type="xs:string" name="estado"/>
          </xs:complexType>
        </xs:element>
      </xs:sequence>
    </xs:complexType>
  </xs:element>
</xs:schema>